id	term	pmids	expected_cuis	why	disallowed_cuis	retmax
pubmed_status_migrainosus	status migrainosus treatment review	38307660|30198804	C0338489|C0154723|C0338480|C0075632|C0003211|C0000970|C0024480|C0012291	PubMed status migrainosus abstracts should retrieve the complication, migraine aura variants, and treatment concepts.	C0030768|C0206488|C1709941|C3846076|C0541653|C0206176|C0730229|C5418818	2
pubmed_egfr_nsclc	EGFR mutated non-small cell lung cancer osimertinib brain metastases progression free survival	39951884|37879444	C0007131|C1414313|C4058811|C0242792|C0032207|C0220650	PubMed EGFR-mutant NSCLC abstracts should retrieve NSCLC, EGFR, therapy, survival, platinum, and brain metastasis concepts.		2
pubmed_cdiff_antibiotic_diarrhea	Clostridioides difficile antibiotic associated diarrhea oral vancomycin		C0578159|C0011991|C0343386|C0042313|C0003232	PubMed C. difficile abstracts should retrieve antibiotic-associated diarrhea, diarrhea, C. difficile infection, vancomycin, and antibiotic exposure.	C0003392|C0004611	2
pubmed_lupus_preeclampsia	pregnancy lupus nephritis preeclampsia proteinuria complement		C0024141|C0024143|C0032914|C0033687|C0009506	PubMed pregnancy/lupus abstracts should retrieve SLE, lupus nephritis, preeclampsia, proteinuria, and complement concepts.		2
pubmed_stroke_thrombectomy	large vessel occlusion tenecteplase mechanical thrombectomy aphasia		C0948008|C0003537|C1536105|C0872913|C4534538	PubMed stroke abstracts should retrieve ischemic stroke, aphasia, CTA, tenecteplase, and mechanical thrombectomy.		2
pubmed_covid_ards_shock	COVID-19 acute respiratory distress syndrome septic shock acute kidney injury		C5203670|C0035222|C0036983|C2609414|C0199470|C4551696	PubMed ICU COVID abstracts should retrieve COVID-19, ARDS, septic shock, AKI, ventilation, and prone positioning.		2
pubmed_cyp2c19_clopidogrel	CYP2C19 poor metabolizer clopidogrel ticagrelor percutaneous coronary intervention		C1332828|C3845231|C0070166|C1999375|C1532338	PubMed pharmacogenomics abstracts should retrieve CYP2C19, poor metabolizer, clopidogrel, ticagrelor, and PCI concepts.		2
